<?xml version="1.0" encoding="UTF-8"?>
<xs:schema xmlns:xs="http://www.w3.org/2001/XMLSchema">
   <xs:include schemaLocation="Version.xsd"/>
   <!-- todo <xs:redefine schemaLocation="Version.xsd">-->
   <!-- *************************************************
         min- and maxInclusive have to be the same value
         this value has to be changed on every change of this file !!
         *************************************************** -->
   <!--<xs:simpleType name="VersionType">
         <xs:restriction base="VersionType">
            <xs:minInclusive value="5"/>
            <xs:maxInclusive value="5"/>
         </xs:restriction>
      </xs:simpleType>
   </xs:redefine>-->
   <xs:include schemaLocation="Units.xsd"/>
   <xs:element name="KRCThread">
      <xs:complexType>
         <xs:attribute name="Priority" type="xs:integer" use="required"/>
         <xs:attribute name="CycleTime" type="xs:double" use="required"/>
         <xs:attribute name="DelayTime" type="xs:double" use="optional"/>
      </xs:complexType>
   </xs:element>
   <xs:element name="DrivesOn">
      <xs:complexType>
         <xs:attribute name="Timeout" type="usTimeType" use="required"/>
      </xs:complexType>
   </xs:element>
   <xs:element name="PowerOff">
      <xs:complexType>
         <xs:attribute name="DelayTime" type="usTimeType" use="required"/>
      </xs:complexType>
   </xs:element>
   <xs:element name="EmergencyStop">
      <xs:complexType>
         <xs:attribute name="Timeout" type="usTimeType" use="required"/>
      </xs:complexType>
   </xs:element>
   <xs:element name="Layer">
      <xs:complexType>
         <xs:attribute name="CycleTime" type="xs:integer" use="required"/>
         <xs:attribute name="ID" type="xs:integer" use="required"/>
         <xs:attribute name="PriorityOffset" type="xs:integer" use="required"/>
      </xs:complexType>
   </xs:element>
   <xs:element name="Timing">
      <xs:complexType>
         <xs:attribute name="RobotIntQuota" type="xs:double" use="required"/>
         <xs:attribute name="SubmitIntQuota" type="xs:double" use="required"/>
         <xs:attribute name="ExtSubmitInt1Quota" type="xs:double" use="optional"/>
         <xs:attribute name="ExtSubmitInt2Quota" type="xs:double" use="optional"/>
         <xs:attribute name="ExtSubmitInt3Quota" type="xs:double" use="optional"/>
         <xs:attribute name="ExtSubmitInt4Quota" type="xs:double" use="optional"/>
         <xs:attribute name="ExtSubmitInt5Quota" type="xs:double" use="optional"/>
         <xs:attribute name="ExtSubmitInt6Quota" type="xs:double" use="optional"/>
         <xs:attribute name="ExtSubmitInt7Quota" type="xs:double" use="optional"/>
         <xs:attribute name="ExprIntQuota" type="xs:double" use="required"/>
         <xs:attribute name="RobotIntDelay" type="xs:integer" use="required"/>
         <xs:attribute name="SubmitIntDelay" type="xs:integer" use="required"/>
         <xs:attribute name="ExtSubmitInt1Delay" type="xs:integer" use="optional"/>
         <xs:attribute name="ExtSubmitInt2Delay" type="xs:integer" use="optional"/>
         <xs:attribute name="ExtSubmitInt3Delay" type="xs:integer" use="optional"/>
         <xs:attribute name="ExtSubmitInt4Delay" type="xs:integer" use="optional"/>
         <xs:attribute name="ExtSubmitInt5Delay" type="xs:integer" use="optional"/>
         <xs:attribute name="ExtSubmitInt6Delay" type="xs:integer" use="optional"/>
         <xs:attribute name="ExtSubmitInt7Delay" type="xs:integer" use="optional"/>
         <xs:attribute name="ExprIntDelay" type="xs:integer" use="required"/>
      </xs:complexType>
   </xs:element>
   <xs:element name="Scheduling">
      <xs:complexType>
         <xs:sequence>
            <xs:element ref="Layer" minOccurs="10" maxOccurs="10"/>
            <xs:element ref="Timing"/>
         </xs:sequence>
         <xs:attribute name="ClockCycleTime" type="xs:double" use="required"/>
      </xs:complexType>
   </xs:element>
   <xs:element name="PcFanCheck">
      <xs:complexType>
         <xs:attribute name="AlarmRevolution" type="xs:integer" use="required"/>
         <xs:attribute name="Enable" type="xs:boolean" use="required"/>
         <xs:attribute name="ImpulsesPerRevolution" type="xs:integer" use="required"/>
         <xs:attribute name="WarningRevolution" type="xs:integer" use="required"/>
      </xs:complexType>
   </xs:element>
   <xs:element name="CabinetFanCheck">
      <xs:complexType>
         <xs:attribute name="AlarmRevolution" type="xs:integer" use="required"/>
         <xs:attribute name="Enable" type="xs:boolean" use="required"/>
         <xs:attribute name="ImpulsesPerRevolution" type="xs:integer" use="required"/>
         <xs:attribute name="WarningRevolution" type="xs:integer" use="required"/>
      </xs:complexType>
   </xs:element>
   <xs:element name="InfoHandlerThread">
      <xs:complexType>
         <xs:attribute name="CycleTime" type="usTimeType" use="required"/>
         <xs:attribute name="PowerOffDelayTime" type="usTimeType" use="required"/>
      </xs:complexType>
   </xs:element>
   <xs:element name="FctCallChannel">
      <xs:complexType>
         <xs:attribute name="Enable" type="xs:boolean" default="false"/>
         <xs:attribute name="TaskStackBytes" type="xs:unsignedInt" default="40960"/>
      </xs:complexType>
   </xs:element>
   <xs:element name="MultiSubmit">
      <xs:complexType>
         <xs:attribute name="Enable" type="xs:boolean" use="required"/>
      </xs:complexType>
   </xs:element>
   <xs:element name="AllowDoubleDollarVar">
      <xs:complexType>
         <xs:attribute name="Enable" type="xs:boolean" use="optional"/>
      </xs:complexType>
   </xs:element>
   <xs:element name="Axes">
      <xs:complexType>
         <xs:attribute name="ConfigFile" type="xs:anyURI" use="required"/>
      </xs:complexType>
   </xs:element>
   <xs:element name="WORKSPACE_PORT">
      <xs:complexType>
         <xs:attribute name="Value" type="xs:unsignedInt" use="required"/>
      </xs:complexType>
   </xs:element>
   <xs:element name="PROGSYNC_PORT">
      <xs:complexType>
         <xs:attribute name="Value" type="xs:unsignedInt" use="required"/>
      </xs:complexType>
   </xs:element>
   <xs:element name="MOTIONSYNC_PORT">
      <xs:complexType>
         <xs:attribute name="Value" type="xs:unsignedInt" use="required"/>
      </xs:complexType>
   </xs:element>
   <xs:element name="COLLAVOID_PORT">
      <xs:complexType>
         <xs:attribute name="Value" type="xs:unsignedInt" use="required"/>
      </xs:complexType>
   </xs:element>
   <xs:element name="ADS_DATENPORT">
      <xs:complexType>
         <xs:attribute name="Value" type="xs:unsignedInt" use="required"/>
      </xs:complexType>
   </xs:element>
   <xs:element name="ADS_TCP_IP">
      <xs:complexType>
         <xs:sequence>
            <xs:element ref="ADS_DATENPORT"/>
         </xs:sequence>
      </xs:complexType>
   </xs:element>
   <xs:element name="CRPORTS">
      <xs:complexType>
         <xs:sequence>
            <xs:element ref="MOTIONSYNC_PORT"/>
            <xs:element ref="WORKSPACE_PORT"/>
            <xs:element ref="PROGSYNC_PORT"/>
            <xs:element ref="COLLAVOID_PORT"/>
         </xs:sequence>
      </xs:complexType>
   </xs:element>
   <xs:element name="ApplicationOverride">
      <xs:complexType>
         <xs:attribute name="Minimum" use="required">
            <xs:simpleType>
               <xs:restriction base="xs:double">
                  <xs:minInclusive value="0.0"/>
               </xs:restriction>
            </xs:simpleType>
         </xs:attribute>
         <xs:attribute name="Maximum" use="required">
            <xs:simpleType>
               <xs:restriction base="xs:double">
                  <xs:maxInclusive value="130.0"/>
               </xs:restriction>
            </xs:simpleType>
         </xs:attribute>
      </xs:complexType>
   </xs:element>
   <xs:element name="KRC">
      <xs:complexType>
         <xs:sequence>
            <xs:element ref="Version"/>
            <xs:element ref="KRCThread"/>
            <xs:element ref="DrivesOn"/>
            <xs:element ref="PowerOff"/>
            <xs:element ref="EmergencyStop"/>
            <xs:element ref="Scheduling"/>
            <xs:element ref="MultiSubmit" minOccurs="0"/>
            <xs:element ref="AllowDoubleDollarVar"/>
            <xs:element ref="Axes"/>
            <xs:element ref="PcFanCheck" minOccurs="0"/>
            <xs:element ref="CabinetFanCheck" minOccurs="0"/>
            <xs:element ref="InfoHandlerThread"/>
            <xs:element ref="FctCallChannel" minOccurs="0"/>
            <xs:element ref="ADS_TCP_IP" minOccurs="0"/>
            <xs:element ref="CRPORTS" minOccurs="0"/>
            <xs:element ref="ApplicationOverride" minOccurs="0"/>
         </xs:sequence>
      </xs:complexType>
   </xs:element>
</xs:schema>
